ReviewText,Sentiment
"This product is amazing, I love it!",Positive
"Terrible quality, broke after one day",Negative
"Great value for the price, highly recommend",Positive
"Worst purchase ever, complete waste of money",Negative
"Excellent build quality and fast shipping",Positive
"The product arrived damaged and customer service was unhelpful",Negative
"Very satisfied with this purchase will buy again",
"Not worth the money poor quality materials",
"Perfect gift for my daughter she loves it",
"Disappointing product does not match description",
"Outstanding performance exceeds all expectations",
"Cheap and flimsy would not recommend to anyone",
"Beautiful design and works perfectly",
"Stopped working after a week terrible durability",
"Best thing I have bought this year absolutely wonderful",
"Horrible experience from start to finish avoid this",
"Fantastic product with great features",
"Complete junk fell apart immediately",
"Really happy with this high quality item",
"Awful product returned it immediately",
"Super easy to use and well designed",
"Do not buy this product it is a scam",
"Five stars this is exactly what I needed",
"Regret buying this useless product",
"Amazing quality and very durable material",
"The worst product I have ever purchased online",
"Incredible value works better than expected",
"Total garbage do not waste your money",
"Love everything about this product",
"Extremely poor quality very disappointed overall",
